Question,Factual/Objective,Interpretive,Procedural,Reprogramming,Cell Bio,Epigenetics,Experiments,Cancer,Dynamical Systems,Networks,Higher Order Structure,Linear Algebra,Other,,discard vvvv
"Gene regulation is often described from the perspective of a dynamical system, where gene expression or other measures are used to construct a state space model. In deterministic dynamical systems, the state variable contains sufficient information to determine the future of the system. What experimental measurements do you believe are sufficient to determine the state of a cell?",FALSE,TRUE,FALSE,TRUE,TRUE,FALSE,TRUE,FALSE,TRUE,FALSE,FALSE,FALSE,FALSE,,FALSE
Compare and contrast the utility of dynamical systems and control theory perspectives relative to machine learning models of cellular reprogramming. What are the advantages and disadvantages of each perspective and which data are utilized in each framework?,FALSE,TRUE,TRUE,TRUE,FALSE,FALSE,FALSE,FALSE,TRUE,FALSE,FALSE,FALSE,FALSE,,TRUE
"Synthetic lethality occurs when the knockout of two genes is lethal to a cell while the knockout of either gene separately would not kill the cell. The Yeast-2-Hybrid assay is an experimental technique that can determine if two proteins bind with one another by transplanting the proteins to a yeast cell and attaching them to reporter genes. Are these two ideas related to one another, and if so, how?",TRUE,FALSE,TRUE,FALSE,TRUE,FALSE,TRUE,FALSE,FALSE,FALSE,FALSE,FALSE,FALSE,,TRUE
The addition of transcription factors have been known to activate or deactivate different genes in the nucleus and also bind to chromatin at many points. What is the relationship between TF binding and the activation or suppression of new genes?,FALSE,FALSE,FALSE,FALSE,TRUE,FALSE,FALSE,FALSE,FALSE,FALSE,FALSE,FALSE,FALSE,,TRUE
RNAi is used to silence different genes. How long does it take to silence genes after its introduction? When does suppression begin and when does it end?,TRUE,FALSE,FALSE,TRUE,TRUE,TRUE,FALSE,FALSE,FALSE,FALSE,FALSE,FALSE,FALSE,,FALSE
"What is DAPI and how would you design an experiment to determine how chromatin is arranged within the nucleus? Could this method be used to get either: population, single cell, or time course data, and which would be some reasonable mathematical representations of the data obtained in these experiments?",TRUE,TRUE,TRUE,FALSE,FALSE,FALSE,TRUE,FALSE,FALSE,FALSE,FALSE,FALSE,FALSE,,FALSE
"Upon introduction of exogenous MYOD to a fibroblast cell, endogenous MYOD production will occur. This coincides with the transition of fibroblast cells to myogenic cells, and this was perhaps one of the first direct cell reprogramming experiments. What is the relationship between the concentration of endogenous and exogenous MYOD during this process?",TRUE,FALSE,FALSE,TRUE,FALSE,FALSE,FALSE,FALSE,TRUE,FALSE,FALSE,FALSE,FALSE,,TRUE
Weintraub discovered the importance of MYOD in reprogramming fibroblast to myogenic lineages. Which observations were influential to identifying this reprogramming protocol?,TRUE,FALSE,TRUE,TRUE,FALSE,FALSE,FALSE,FALSE,FALSE,FALSE,FALSE,FALSE,FALSE,,FALSE
"CDK2 and P21 are both involved in cell cycle regulation. In particular, there are some accounts that the regulation of these two genes form a toggle switch. What are the dynamic and bifurcation properties of a toggle and which other genes are involved in regulating CDK2 and P21.",TRUE,FALSE,FALSE,FALSE,TRUE,FALSE,FALSE,FALSE,TRUE,FALSE,FALSE,FALSE,FALSE,,TRUE
"In information theory, entropy represents the concept of surprise or uncertainty in a signal. In physics, entropy represents the amount of disorder in a system. Tell me what entropy does or should represent in biology and genetics.",FALSE,TRUE,FALSE,FALSE,TRUE,FALSE,FALSE,FALSE,FALSE,FALSE,FALSE,FALSE,FALSE,,TRUE
"Cell reprogramming is often associated with the creation of iPSCs from the early to mid-2000s; however, I know that direct cell reprogramming existed far earlier than this by at least two decades. Please explain the history of cell reprogramming.",FALSE,FALSE,FALSE,TRUE,FALSE,FALSE,FALSE,FALSE,FALSE,FALSE,FALSE,FALSE,FALSE,,TRUE
What transcription factors are involved in cell reprogramming of skeletal muscle?,TRUE,FALSE,FALSE,TRUE,FALSE,FALSE,FALSE,FALSE,FALSE,FALSE,FALSE,FALSE,FALSE,,FALSE
What transcription factors are involved in cell reprogramming of stem cells?,TRUE,FALSE,FALSE,TRUE,FALSE,FALSE,FALSE,FALSE,FALSE,FALSE,FALSE,FALSE,FALSE,,FALSE
What are the differences between direct lineage reprogramming and induced pluripotency?,TRUE,FALSE,FALSE,TRUE,FALSE,FALSE,FALSE,FALSE,FALSE,FALSE,FALSE,FALSE,FALSE,,TRUE
What are the potential applications of cell reprogramming in regenerative medicine?,FALSE,TRUE,FALSE,TRUE,FALSE,FALSE,FALSE,FALSE,FALSE,FALSE,FALSE,FALSE,FALSE,,FALSE
How do transcription factors influence epigenetic modifications during the reprogramming process?,FALSE,FALSE,TRUE,TRUE,TRUE,TRUE,FALSE,FALSE,FALSE,FALSE,FALSE,FALSE,FALSE,,TRUE
What are the main challenges and limitations of using transcription factor-mediated reprogramming for therapeutic purposes?,FALSE,TRUE,TRUE,TRUE,FALSE,TRUE,FALSE,FALSE,FALSE,FALSE,FALSE,FALSE,FALSE,,FALSE
"Can transcription factors alone efficiently reprogram cells, or are additional factors or conditions required for successful reprogramming?",TRUE,FALSE,TRUE,TRUE,FALSE,FALSE,FALSE,FALSE,FALSE,FALSE,FALSE,FALSE,FALSE,,TRUE
What role do non-coding RNAs play in transcription factor-mediated cell reprogramming?,FALSE,FALSE,FALSE,TRUE,FALSE,TRUE,FALSE,FALSE,FALSE,FALSE,FALSE,FALSE,FALSE,,TRUE
What are the current methods for delivering transcription factors to cells for reprogramming purposes?,FALSE,FALSE,TRUE,TRUE,FALSE,FALSE,TRUE,FALSE,FALSE,FALSE,FALSE,FALSE,FALSE,,TRUE
How does the overexpression or suppression of specific transcription factors affect the stability and functionality of reprogrammed cells?,FALSE,FALSE,FALSE,TRUE,TRUE,FALSE,FALSE,FALSE,FALSE,FALSE,FALSE,FALSE,FALSE,,TRUE
What are master regulators?,TRUE,FALSE,FALSE,FALSE,TRUE,FALSE,FALSE,FALSE,FALSE,FALSE,FALSE,FALSE,FALSE,,TRUE
How are pioneer factors different from master regulators?,FALSE,TRUE,FALSE,FALSE,TRUE,FALSE,FALSE,FALSE,FALSE,FALSE,FALSE,FALSE,FALSE,,TRUE
Are all transcription factors master regulators?,TRUE,FALSE,FALSE,FALSE,TRUE,FALSE,FALSE,FALSE,FALSE,FALSE,FALSE,FALSE,FALSE,,TRUE
What proportion of genes are transcription factors?,TRUE,FALSE,FALSE,FALSE,TRUE,FALSE,FALSE,FALSE,FALSE,FALSE,FALSE,FALSE,FALSE,,FALSE
What is cellular reprogramming and how is it achieved?,FALSE,FALSE,TRUE,TRUE,FALSE,FALSE,FALSE,FALSE,FALSE,FALSE,FALSE,FALSE,FALSE,,TRUE
What are the potential applications of cellular reprogramming in medicine?,FALSE,TRUE,FALSE,TRUE,FALSE,FALSE,FALSE,FALSE,FALSE,FALSE,FALSE,FALSE,FALSE,,FALSE
How do transcription factors regulate gene expression?,TRUE,FALSE,FALSE,FALSE,TRUE,FALSE,FALSE,FALSE,FALSE,FALSE,FALSE,FALSE,FALSE,,TRUE
What are the main types of transcription factors and how do they function?,FALSE,TRUE,FALSE,FALSE,TRUE,FALSE,FALSE,FALSE,FALSE,FALSE,FALSE,FALSE,FALSE,,TRUE
How do transcription factors influence cellular differentiation?,FALSE,FALSE,FALSE,FALSE,TRUE,FALSE,FALSE,FALSE,FALSE,FALSE,FALSE,FALSE,FALSE,,TRUE
What role do transcription factors play in cellular reprogramming?,FALSE,FALSE,FALSE,TRUE,FALSE,FALSE,FALSE,FALSE,FALSE,FALSE,FALSE,FALSE,FALSE,,TRUE
How are transcription factors used in induced pluripotent stem cell (iPSC) generation?,TRUE,FALSE,TRUE,TRUE,FALSE,FALSE,FALSE,FALSE,FALSE,FALSE,FALSE,FALSE,FALSE,,TRUE
What are the key differences between transcription factors and other regulators of gene expression?,FALSE,TRUE,FALSE,FALSE,TRUE,FALSE,FALSE,FALSE,FALSE,FALSE,FALSE,FALSE,FALSE,,TRUE
What is the cell cycle and what are its phases?,TRUE,FALSE,FALSE,FALSE,TRUE,FALSE,FALSE,FALSE,FALSE,FALSE,FALSE,FALSE,FALSE,,TRUE
How is the cell cycle regulated at the molecular level?,FALSE,FALSE,FALSE,FALSE,TRUE,FALSE,FALSE,FALSE,FALSE,FALSE,FALSE,FALSE,FALSE,,TRUE
How do transcription factors control progression through the cell cycle?,FALSE,FALSE,FALSE,FALSE,TRUE,FALSE,FALSE,FALSE,FALSE,FALSE,FALSE,FALSE,FALSE,,TRUE
How do different cell cycle phases contribute to cellular reprogramming?,FALSE,FALSE,FALSE,TRUE,TRUE,FALSE,FALSE,FALSE,FALSE,FALSE,FALSE,FALSE,FALSE,,TRUE
What are the implications of cell cycle dysregulation in disease?,FALSE,TRUE,FALSE,FALSE,TRUE,FALSE,FALSE,FALSE,FALSE,FALSE,FALSE,FALSE,FALSE,,TRUE
How are transcription factors involved in maintaining cell cycle integrity?,FALSE,TRUE,FALSE,FALSE,TRUE,FALSE,FALSE,FALSE,FALSE,FALSE,FALSE,FALSE,FALSE,,TRUE
How do transcription factors interact with cyclins and cyclin-dependent kinases?,FALSE,FALSE,FALSE,FALSE,TRUE,FALSE,FALSE,FALSE,FALSE,FALSE,FALSE,FALSE,FALSE,,TRUE
What are the key checkpoints in the cell cycle and how do they function?,FALSE,TRUE,FALSE,FALSE,TRUE,FALSE,FALSE,FALSE,FALSE,FALSE,FALSE,FALSE,FALSE,,TRUE
How does the expression of transcription factors change across different phases of the cell cycle?,FALSE,TRUE,FALSE,FALSE,TRUE,FALSE,FALSE,FALSE,FALSE,FALSE,FALSE,FALSE,FALSE,,TRUE
What role do transcription factors play in cell fate determination during the cell cycle?,FALSE,FALSE,FALSE,FALSE,TRUE,FALSE,FALSE,FALSE,FALSE,FALSE,FALSE,FALSE,FALSE,,TRUE
How does cellular reprogramming affect the cell cycle of reprogrammed cells?,FALSE,FALSE,FALSE,FALSE,TRUE,FALSE,FALSE,FALSE,FALSE,FALSE,FALSE,FALSE,FALSE,,TRUE
How can transcription factors be targeted to regulate the cell cycle in cancer therapy?,FALSE,TRUE,TRUE,FALSE,TRUE,FALSE,FALSE,FALSE,FALSE,FALSE,FALSE,FALSE,FALSE,,FALSE
What are the ethical considerations of using transcription factors in cellular reprogramming?,FALSE,TRUE,TRUE,TRUE,FALSE,FALSE,FALSE,FALSE,FALSE,FALSE,FALSE,FALSE,FALSE,,TRUE
How do cellular reprogramming and transcription factor therapy compare as potential treatments for diseases?,FALSE,TRUE,TRUE,TRUE,TRUE,FALSE,FALSE,FALSE,FALSE,FALSE,FALSE,FALSE,FALSE,,TRUE
How does epigenetic regulation influence transcription factor activity during the cell cycle?,FALSE,FALSE,FALSE,FALSE,TRUE,TRUE,FALSE,FALSE,FALSE,FALSE,FALSE,FALSE,FALSE,,TRUE
How are transcription factors identified and validated as regulators of the cell cycle?,FALSE,FALSE,FALSE,FALSE,TRUE,FALSE,FALSE,FALSE,FALSE,FALSE,FALSE,FALSE,FALSE,,TRUE
What are the challenges and future directions for research in cellular reprogramming and transcription factor biology?,FALSE,TRUE,TRUE,TRUE,TRUE,FALSE,FALSE,FALSE,FALSE,FALSE,FALSE,FALSE,FALSE,,FALSE
What techniques are used to identify transcription factor binding motifs?,TRUE,FALSE,TRUE,FALSE,TRUE,TRUE,FALSE,FALSE,FALSE,FALSE,FALSE,FALSE,FALSE,,FALSE
What is a transcription factor binding motif?,TRUE,FALSE,FALSE,FALSE,TRUE,TRUE,FALSE,FALSE,FALSE,FALSE,FALSE,FALSE,FALSE,,TRUE
Where does myod bind?,TRUE,FALSE,FALSE,FALSE,TRUE,TRUE,FALSE,FALSE,FALSE,FALSE,FALSE,FALSE,FALSE,,FALSE
What are the targets and first order interactions of MYOD?,TRUE,FALSE,FALSE,FALSE,TRUE,FALSE,FALSE,FALSE,FALSE,FALSE,FALSE,FALSE,FALSE,,FALSE
Who performed the first cell reprogramming experiment?,TRUE,FALSE,FALSE,TRUE,FALSE,FALSE,FALSE,FALSE,FALSE,FALSE,FALSE,FALSE,FALSE,,FALSE
Which cell types are common precursors in cell reprogramming?,FALSE,TRUE,FALSE,TRUE,FALSE,FALSE,FALSE,FALSE,FALSE,FALSE,FALSE,FALSE,FALSE,,FALSE
Explain the problem of identifying transcription factors for reprogramming in terms of control theory,FALSE,TRUE,FALSE,TRUE,FALSE,FALSE,FALSE,FALSE,TRUE,FALSE,FALSE,FALSE,FALSE,,TRUE
Explain the problem of identifying transcription factors in terms of machine learning,FALSE,TRUE,FALSE,TRUE,FALSE,FALSE,FALSE,FALSE,FALSE,FALSE,FALSE,FALSE,FALSE,,TRUE
How does the Human TFome library enhance our understanding of cell differentiation compared to previous transcription factor libraries and approaches?,FALSE,TRUE,FALSE,FALSE,TRUE,FALSE,FALSE,FALSE,FALSE,FALSE,FALSE,FALSE,FALSE,,TRUE
Can you describe an experimental setup and screening process used to identify TFs that can induce differentiation in hPSCs without external soluble or biomechanical cues?,FALSE,FALSE,TRUE,FALSE,TRUE,FALSE,TRUE,FALSE,FALSE,FALSE,FALSE,FALSE,FALSE,,TRUE
What criteria and or methodologies were used to determine the TFs that induce differentiation in human pluripotent stem cells (hPSCs) within 4 days?,FALSE,FALSE,TRUE,FALSE,FALSE,FALSE,FALSE,FALSE,FALSE,FALSE,FALSE,FALSE,FALSE,,TRUE
What are the potential applications of the cell-autonomous programming approach in regenerative medicine and tissue engineering?,FALSE,TRUE,TRUE,FALSE,FALSE,FALSE,FALSE,FALSE,FALSE,FALSE,FALSE,FALSE,FALSE,,TRUE
"How did the researchers validate that the differentiated cells (neurons, fibroblasts, oligodendrocytes, and vascular endothelial-like cells) exhibit molecular and functional similarities to primary cells?",FALSE,FALSE,TRUE,FALSE,FALSE,FALSE,FALSE,FALSE,FALSE,FALSE,FALSE,FALSE,FALSE,,TRUE
"What is the primary challenge with transcription factor overexpression-based methods for generating cell types in vitro, and how does the new computer-guided design tool address this issue?",FALSE,TRUE,TRUE,FALSE,FALSE,FALSE,FALSE,FALSE,FALSE,FALSE,FALSE,FALSE,FALSE,,TRUE
Can you explain the role and mechanism of the IRENE computational framework in prioritizing instructive factors (IFs) for cellular conversions?,FALSE,FALSE,TRUE,FALSE,FALSE,FALSE,FALSE,FALSE,FALSE,FALSE,FALSE,FALSE,FALSE,,TRUE
How does the transposon-based genomic integration system enhance the efficiency of delivering instructive factors compared to other delivery methods?,FALSE,FALSE,TRUE,FALSE,FALSE,FALSE,FALSE,FALSE,FALSE,FALSE,FALSE,FALSE,FALSE,,TRUE
What specific metrics or criteria does IRENE use to maximize the agreement of the transcriptional and epigenetic landscapes between converted and target cells?,TRUE,FALSE,TRUE,FALSE,FALSE,FALSE,FALSE,FALSE,FALSE,FALSE,FALSE,FALSE,FALSE,,FALSE
How did the use of IRENE impact the efficiency of existing iPSC-differentiation protocols for natural killer cells and melanocytes?,FALSE,FALSE,TRUE,FALSE,FALSE,FALSE,FALSE,FALSE,FALSE,FALSE,FALSE,FALSE,FALSE,,TRUE
What experimental validations were performed to confirm the high efficiency of the new iPSC-derived mammary epithelial cell protocol established using IRENE?,TRUE,FALSE,TRUE,FALSE,FALSE,FALSE,FALSE,FALSE,FALSE,FALSE,FALSE,FALSE,FALSE,,FALSE
In what ways can computational approaches like IRENE complement traditional experimental methods in the field of cellular conversion and differentiation?,FALSE,FALSE,TRUE,FALSE,FALSE,FALSE,FALSE,FALSE,FALSE,FALSE,FALSE,FALSE,FALSE,,TRUE
"What potential applications could the increased efficiency of iPSC-differentiation protocols have in clinical settings, such as cell transplantation therapies or disease modeling?",FALSE,TRUE,TRUE,FALSE,FALSE,FALSE,FALSE,FALSE,FALSE,FALSE,FALSE,FALSE,FALSE,,TRUE
"How does the stochastic gene regulatory network model employed by IRENE differ from deterministic models, and what advantages does it offer in predicting efficient instructive factors?",FALSE,FALSE,TRUE,FALSE,FALSE,FALSE,FALSE,FALSE,FALSE,FALSE,FALSE,FALSE,FALSE,,TRUE
What future developments or improvements do the researchers anticipate for the IRENE tool and its applications in cell conversion technologies?,FALSE,TRUE,TRUE,FALSE,FALSE,FALSE,FALSE,FALSE,FALSE,FALSE,FALSE,FALSE,FALSE,,FALSE
"What is the significance of MyoD as a master regulatory gene for myogenesis, and how does it influence muscle differentiation?",FALSE,TRUE,FALSE,FALSE,FALSE,FALSE,FALSE,FALSE,FALSE,FALSE,FALSE,FALSE,FALSE,,TRUE
How does the use of a retroviral long terminal repeat enhance the expression of MyoD in various differentiated cell types?,TRUE,FALSE,FALSE,FALSE,FALSE,FALSE,FALSE,FALSE,FALSE,FALSE,FALSE,FALSE,FALSE,,TRUE
"What methodologies were employed to introduce MyoD into differentiated cell types, and what are the comparative advantages of using a DNA transfection vector versus a retrovirus?",TRUE,TRUE,TRUE,FALSE,FALSE,FALSE,FALSE,FALSE,FALSE,FALSE,FALSE,FALSE,FALSE,,TRUE
"In what ways did the expression of MyoD lead to the activation of muscle-specific proteins in primary fibroblasts and differentiated cell lines from chicken, human, and rat?",FALSE,TRUE,FALSE,FALSE,FALSE,FALSE,FALSE,FALSE,FALSE,FALSE,FALSE,FALSE,FALSE,,TRUE
"How did MyoD expression affect differentiated cell lines such as melanoma, neuroblastoma, liver, and adipocyte cells, and what does this reveal about MyoD's versatility?",FALSE,TRUE,FALSE,FALSE,FALSE,FALSE,FALSE,FALSE,FALSE,FALSE,FALSE,FALSE,FALSE,,TRUE
What evidence supports the conclusion that MyoD alone is sufficient to activate the downstream program for terminal muscle differentiation in various cell types?,FALSE,FALSE,FALSE,FALSE,FALSE,FALSE,FALSE,FALSE,FALSE,FALSE,FALSE,FALSE,FALSE,,TRUE
How do the findings regarding MyoD's ability to activate muscle genes in different cell lines challenge the current understanding of tissue-specific factors in muscle differentiation?,FALSE,TRUE,FALSE,FALSE,FALSE,FALSE,FALSE,FALSE,FALSE,FALSE,FALSE,FALSE,FALSE,,TRUE
"What potential mechanisms might explain how MyoD activates other tissue-specific factors, if such factors are necessary for muscle differentiation?",TRUE,FALSE,FALSE,FALSE,FALSE,FALSE,FALSE,FALSE,FALSE,FALSE,FALSE,FALSE,FALSE,,FALSE
What implications do these findings have for the development of gene therapies or regenerative medicine approaches targeting muscle-related diseases?,FALSE,TRUE,FALSE,FALSE,FALSE,FALSE,FALSE,FALSE,FALSE,FALSE,FALSE,FALSE,FALSE,,TRUE
How might future research build on these findings to further elucidate the role of MyoD and other potential factors in muscle differentiation and cell reprogramming?,FALSE,TRUE,TRUE,FALSE,FALSE,FALSE,FALSE,FALSE,FALSE,FALSE,FALSE,FALSE,FALSE,,FALSE
What is the significance of the correlation between the intranuclear position of genes and their activity state in the context of gene expression regulation?,FALSE,TRUE,FALSE,FALSE,FALSE,FALSE,FALSE,FALSE,FALSE,FALSE,FALSE,FALSE,FALSE,,FALSE
"How do 'transcription factories' function, and what is their role in nascent RNA production and RNA polymerase II activity?",TRUE,FALSE,FALSE,FALSE,FALSE,FALSE,FALSE,FALSE,FALSE,FALSE,FALSE,FALSE,FALSE,,FALSE
What methodologies were used to demonstrate that distal genes colocalize to the same transcription factory at high frequencies during transcription in vivo?,TRUE,FALSE,TRUE,FALSE,FALSE,FALSE,FALSE,FALSE,FALSE,FALSE,FALSE,FALSE,FALSE,,FALSE
How do shared nuclear subcompartments influence the dynamic organization and activity of active genes?,TRUE,FALSE,FALSE,FALSE,FALSE,FALSE,FALSE,FALSE,FALSE,FALSE,FALSE,FALSE,FALSE,,FALSE
What mechanisms might explain the migration of active genes into or out of transcription factories and its impact on transcription activation or abatement?,FALSE,FALSE,FALSE,FALSE,FALSE,FALSE,FALSE,FALSE,FALSE,FALSE,FALSE,FALSE,FALSE,,FALSE
How does the concept of genes migrating to preassembled transcription sites challenge the traditional understanding of transcription complex recruitment and assembly?,FALSE,TRUE,FALSE,FALSE,FALSE,FALSE,FALSE,FALSE,FALSE,FALSE,FALSE,FALSE,FALSE,,FALSE
What implications do these findings have for our understanding of nuclear organization and its role in gene regulation?,FALSE,FALSE,TRUE,FALSE,FALSE,FALSE,FALSE,FALSE,FALSE,FALSE,FALSE,FALSE,FALSE,,FALSE
"What experimental evidence supports the idea that multiple genes can occupy the same transcription factory, and what challenges remain in directly observing this phenomenon?",FALSE,FALSE,FALSE,FALSE,FALSE,FALSE,FALSE,FALSE,FALSE,FALSE,FALSE,FALSE,FALSE,,FALSE
How might the findings about gene colocalization in transcription factories influence future research on gene expression and nuclear architecture?,FALSE,TRUE,FALSE,FALSE,FALSE,FALSE,FALSE,FALSE,FALSE,FALSE,FALSE,FALSE,FALSE,,FALSE
What potential applications could arise from understanding the dynamics of gene movement into and out of transcription factories in terms of disease treatment or genetic engineering?,FALSE,TRUE,FALSE,FALSE,FALSE,FALSE,FALSE,FALSE,FALSE,FALSE,FALSE,FALSE,FALSE,,FALSE
What are the key advances in cell fate manipulation and induction of pluripotency over the past decade?,FALSE,TRUE,FALSE,FALSE,FALSE,FALSE,FALSE,FALSE,FALSE,FALSE,FALSE,FALSE,FALSE,,FALSE
What technical aspects make the generation of induced pluripotent stem cells (iPSCs) relatively simple?,FALSE,FALSE,TRUE,FALSE,FALSE,FALSE,FALSE,FALSE,FALSE,FALSE,FALSE,FALSE,FALSE,,FALSE
"What roles do the transcription factors OCT3/4, SOX2, KLF4, and MYC (collectively referred to as OSKM) play in the reprogramming of host cells to iPSCs?",TRUE,FALSE,FALSE,FALSE,FALSE,FALSE,FALSE,FALSE,FALSE,FALSE,FALSE,FALSE,FALSE,,FALSE
What are some of the poorly understood mechanisms underlying transcription factor-mediated reprogramming?,FALSE,TRUE,FALSE,FALSE,FALSE,FALSE,FALSE,FALSE,FALSE,FALSE,FALSE,FALSE,FALSE,,FALSE
What recent mechanistic insights have been obtained regarding the process of reprogramming cells into iPSCs?,TRUE,FALSE,TRUE,FALSE,FALSE,FALSE,FALSE,FALSE,FALSE,FALSE,FALSE,FALSE,FALSE,,FALSE
"How has the efficiency of iPSC generation techniques improved in recent years, and what methods contributed to these improvements?",TRUE,TRUE,TRUE,FALSE,FALSE,FALSE,FALSE,FALSE,FALSE,FALSE,FALSE,FALSE,FALSE,,FALSE
What are the potential applications of more efficient iPSC generation techniques in regenerative medicine?,FALSE,TRUE,TRUE,FALSE,FALSE,FALSE,FALSE,FALSE,FALSE,FALSE,FALSE,FALSE,FALSE,,FALSE
How can advances in iPSC technology contribute to disease modeling and drug discovery?,FALSE,TRUE,TRUE,FALSE,FALSE,FALSE,FALSE,FALSE,FALSE,FALSE,FALSE,FALSE,FALSE,,FALSE
What challenges remain in fully understanding and optimizing the transcription factor-mediated reprogramming process?,FALSE,TRUE,TRUE,FALSE,FALSE,TRUE,TRUE,FALSE,FALSE,FALSE,FALSE,FALSE,FALSE,,TRUE
How might future research build on recent insights to further enhance the applications and efficiency of iPSC technology?,FALSE,TRUE,FALSE,TRUE,FALSE,FALSE,FALSE,FALSE,FALSE,FALSE,FALSE,FALSE,FALSE,,TRUE
What roles do transcription factors and chromatin-mediated gene silencing play in the process of development?,TRUE,FALSE,FALSE,FALSE,FALSE,TRUE,FALSE,FALSE,FALSE,FALSE,FALSE,FALSE,FALSE,,FALSE
"How can the mis-expression of master regulator transcription factors reverse or redirect development, and what implications does this have for cancer development?",TRUE,TRUE,FALSE,FALSE,FALSE,TRUE,FALSE,TRUE,FALSE,FALSE,FALSE,FALSE,FALSE,,FALSE
What is the function of the wing-specific Vestigial master regulator in the context of reprogramming the developing eye?,TRUE,FALSE,FALSE,TRUE,FALSE,FALSE,FALSE,FALSE,FALSE,FALSE,FALSE,FALSE,FALSE,,FALSE
"How does the H3.3K27M oncohistone mutation inhibit histone H3K27 trimethylation, and what is the significance of this inhibition in gene silencing?",FALSE,FALSE,FALSE,FALSE,FALSE,TRUE,FALSE,FALSE,FALSE,FALSE,FALSE,FALSE,FALSE,,TRUE
"What findings were observed when the H3.3K27M oncohistone mutation was expressed, and how did it affect eye-to-wing reprogramming?",FALSE,TRUE,FALSE,TRUE,FALSE,FALSE,FALSE,FALSE,FALSE,FALSE,FALSE,FALSE,FALSE,,FALSE
"What is CUT&Tag chromatin profiling, and how was it used to analyze mutant tissues in this study?",TRUE,FALSE,FALSE,FALSE,FALSE,TRUE,FALSE,FALSE,FALSE,FALSE,FALSE,FALSE,FALSE,,TRUE
How does the reduction of H3K27me3 domains upon oncohistone production suggest the necessity of silencing previous developmental programs for effective transformation?,FALSE,FALSE,FALSE,FALSE,FALSE,TRUE,FALSE,FALSE,FALSE,FALSE,FALSE,FALSE,FALSE,,TRUE
"In what ways do the Vestigial master regulator and H3.3K27M mutation synergize to stimulate overgrowth of eye tissue, and how does this phenotype resemble mutations in Polycomb silencing components?",FALSE,TRUE,FALSE,FALSE,FALSE,TRUE,FALSE,FALSE,FALSE,FALSE,FALSE,FALSE,FALSE,,FALSE
What insights did transcriptome profiling of elongating RNA Polymerase II provide regarding the mis-regulation of signaling factors and tissue overgrowth?,FALSE,TRUE,FALSE,FALSE,FALSE,TRUE,FALSE,FALSE,FALSE,FALSE,FALSE,FALSE,FALSE,,FALSE
"What challenges have researchers faced in linking genomic alterations to the transcriptional identity of cancer cells, and how does this study aim to address them?",FALSE,TRUE,FALSE,FALSE,FALSE,TRUE,FALSE,TRUE,FALSE,FALSE,FALSE,FALSE,FALSE,,FALSE
How does the network-based approach used in this study facilitate the identification of master regulator (MR) proteins in cancer?,FALSE,FALSE,TRUE,FALSE,TRUE,FALSE,TRUE,FALSE,FALSE,TRUE,FALSE,FALSE,FALSE,,FALSE
What criteria and methods were used to identify the 407 master regulator proteins across the 20 cohorts from The Cancer Genome Atlas (TCGA)?,TRUE,FALSE,TRUE,FALSE,FALSE,TRUE,FALSE,FALSE,FALSE,FALSE,FALSE,FALSE,FALSE,,FALSE
How are the 112 transcriptionally distinct tumor subtypes defined and characterized in this study?,FALSE,FALSE,FALSE,FALSE,FALSE,TRUE,FALSE,TRUE,FALSE,FALSE,FALSE,FALSE,FALSE,,TRUE
"What are master regulator block modules (MRBs), and how were the 24 pan-cancer MRBs identified and organized?",FALSE,FALSE,FALSE,FALSE,FALSE,TRUE,FALSE,FALSE,FALSE,FALSE,FALSE,FALSE,FALSE,,FALSE
In what ways do MRBs regulate key cancer hallmarks and influence patient outcomes across multiple cohorts?,TRUE,FALSE,FALSE,FALSE,FALSE,FALSE,FALSE,TRUE,FALSE,FALSE,FALSE,FALSE,FALSE,,FALSE
What insights were gained regarding the impact of somatic alterations on master regulator activity in individual cancer samples?,FALSE,TRUE,FALSE,FALSE,FALSE,TRUE,FALSE,TRUE,FALSE,FALSE,FALSE,FALSE,FALSE,,FALSE
How do genetic and pharmacological validation assays confirm the predicted effects of upstream mutations on downstream cellular identity and phenotype?,FALSE,FALSE,FALSE,FALSE,TRUE,FALSE,FALSE,FALSE,FALSE,FALSE,FALSE,FALSE,FALSE,,TRUE
